{
  "name": "던전 어드벤처",
  "bpm": 112,
  "bars": 4,
  "beatUnit": 4,
  "barBeats": 4,
  "steps": 64,
  "sounds": [
    {
      "name": "리드",
      "wave": "pulse",
      "pulseWidth": 0.25,
      "attack": 0.005,
      "decay": 0.08,
      "sustain": 0.85,
      "release": 0.06,
      "cutoff": 9000,
      "resonance": 0.3,
      "bitcrush": 0.2,
      "vibrato": 0.12,
      "delay": 0.22,
      "volume": -9
    },
    {
      "name": "베이스",
      "wave": "triangle",
      "attack": 0.004,
      "decay": 0.12,
      "sustain": 0.7,
      "release": 0.08,
      "cutoff": 1400,
      "resonance": 0.4,
      "bitcrush": 0.12,
      "volume": -7
    },
    {
      "name": "아르페지오",
      "wave": "pulse",
      "pulseWidth": 0.125,
      "attack": 0.001,
      "decay": 0.1,
      "sustain": 0,
      "release": 0.05,
      "cutoff": 9500,
      "resonance": 0.4,
      "bitcrush": 0.3,
      "delay": 0.28,
      "volume": -10
    }
  ],
  "tracks": [
    {
      "name": "리드",
      "sound": "리드",
      "notes": [
        {"n": "D5", "t": 0}, {"n": "F5", "t": 4}, {"n": "E5", "t": 8}, {"n": "D5", "t": 12},
        {"n": "F5", "t": 16}, {"n": "D5", "t": 20}, {"n": "A#4", "t": 24}, {"n": "D5", "t": 28},
        {"n": "E5", "t": 32}, {"n": "G5", "t": 36}, {"n": "E5", "t": 40}, {"n": "C5", "t": 44},
        {"n": "C#5", "t": 48}, {"n": "E5", "t": 52}, {"n": "A5", "t": 56}, {"n": "C#5", "t": 60}
      ]
    },
    {
      "name": "아르페지오",
      "sound": "아르페지오",
      "reverb": false,
      "notes": [
        {"n": "D4", "t": 0}, {"n": "F4", "t": 2}, {"n": "A4", "t": 4}, {"n": "D5", "t": 6},
        {"n": "A4", "t": 8}, {"n": "F4", "t": 10}, {"n": "D4", "t": 12}, {"n": "F4", "t": 14},
        {"n": "A#3", "t": 16}, {"n": "D4", "t": 18}, {"n": "F4", "t": 20}, {"n": "A#4", "t": 22},
        {"n": "F4", "t": 24}, {"n": "D4", "t": 26}, {"n": "A#3", "t": 28}, {"n": "D4", "t": 30},
        {"n": "C4", "t": 32}, {"n": "E4", "t": 34}, {"n": "G4", "t": 36}, {"n": "C5", "t": 38},
        {"n": "G4", "t": 40}, {"n": "E4", "t": 42}, {"n": "C4", "t": 44}, {"n": "E4", "t": 46},
        {"n": "A3", "t": 48}, {"n": "C#4", "t": 50}, {"n": "E4", "t": 52}, {"n": "A4", "t": 54},
        {"n": "E4", "t": 56}, {"n": "C#4", "t": 58}, {"n": "A3", "t": 60}, {"n": "C#4", "t": 62}
      ]
    },
    {
      "name": "베이스",
      "sound": "베이스",
      "notes": [
        {"n": "D3", "t": 0}, {"n": "D3", "t": 4}, {"n": "A3", "t": 8}, {"n": "D3", "t": 12},
        {"n": "A#3", "t": 16}, {"n": "A#3", "t": 20}, {"n": "F3", "t": 24}, {"n": "A#3", "t": 28},
        {"n": "C3", "t": 32}, {"n": "C3", "t": 36}, {"n": "G3", "t": 40}, {"n": "C3", "t": 44},
        {"n": "A3", "t": 48}, {"n": "A3", "t": 52}, {"n": "E3", "t": 56}, {"n": "A3", "t": 60}
      ]
    },
    {
      "type": "drums",
      "name": "드럼",
      "notes": [
        {"n": "킥", "t": 0}, {"n": "킥", "t": 8}, {"n": "킥", "t": 16}, {"n": "킥", "t": 24},
        {"n": "킥", "t": 32}, {"n": "킥", "t": 40}, {"n": "킥", "t": 48}, {"n": "킥", "t": 56},
        {"n": "스네어", "t": 4}, {"n": "스네어", "t": 12}, {"n": "스네어", "t": 20}, {"n": "스네어", "t": 28},
        {"n": "스네어", "t": 36}, {"n": "스네어", "t": 44}, {"n": "스네어", "t": 52}, {"n": "스네어", "t": 60},
        {"n": "하이햇", "t": 0}, {"n": "하이햇", "t": 2}, {"n": "하이햇", "t": 4}, {"n": "하이햇", "t": 6},
        {"n": "하이햇", "t": 8}, {"n": "하이햇", "t": 10}, {"n": "하이햇", "t": 12}, {"n": "하이햇", "t": 14},
        {"n": "하이햇", "t": 16}, {"n": "하이햇", "t": 18}, {"n": "하이햇", "t": 20}, {"n": "하이햇", "t": 22},
        {"n": "하이햇", "t": 24}, {"n": "하이햇", "t": 26}, {"n": "하이햇", "t": 28}, {"n": "하이햇", "t": 30},
        {"n": "하이햇", "t": 32}, {"n": "하이햇", "t": 34}, {"n": "하이햇", "t": 36}, {"n": "하이햇", "t": 38},
        {"n": "하이햇", "t": 40}, {"n": "하이햇", "t": 42}, {"n": "하이햇", "t": 44}, {"n": "하이햇", "t": 46},
        {"n": "하이햇", "t": 48}, {"n": "하이햇", "t": 50}, {"n": "하이햇", "t": 52}, {"n": "하이햇", "t": 54},
        {"n": "하이햇", "t": 56}, {"n": "하이햇", "t": 58}, {"n": "하이햇", "t": 60}, {"n": "하이햇", "t": 62}
      ]
    }
  ]
}
